{
  "$schema": "https://othmaneblial.github.io/rustframe/schemas/v1/rustframe.schema.json",
  "schemaVersion": 1,
  "app": {
    "id": "meridian-inventory",
    "title": "Meridian Inventory",
    "windows": [
      { "id": "main", "title": "Meridian Inventory", "route": "/", "width": 1440, "height": 920 }
    ]
  },
  "frontend": {
    "devCommand": "npm run dev",
    "buildCommand": "npm run build",
    "devUrl": "http://127.0.0.1:5173",
    "distDir": "dist",
    "generatedTypes": "rustframe.generated.js"
  },
  "security": {
    "model": "local-first",
    "csp": "default-src 'self'; script-src 'self'; style-src 'self'; img-src 'self' data:; connect-src 'self' http://127.0.0.1:* ws://127.0.0.1:*; object-src 'none'; base-uri 'none'; frame-ancestors 'none'",
    "permissions": [
      { "window": "main", "allow": ["db:read", "db:write"] }
    ]
  },
  "database": { "schema": "data/schema.json", "seeds": "data/seeds", "migrations": "data/migrations" },
  "filesystem": { "roots": [], "persistGrants": true },
  "shell": { "commands": [] },
  "packaging": {
    "version": "0.1.0",
    "identifier": "dev.rustframe.meridian-inventory",
    "description": "An offline warehouse inventory and replenishment desk",
    "publisher": "RustFrame",
    "homepage": "https://github.com/OthmaneBlial/rustframe",
    "icon": "assets/icon.svg",
    "linux": { "categories": ["Office", "Utility"], "keywords": ["inventory", "warehouse", "offline"] },
    "windows": {},
    "macos": {}
  }
}
